Sentence ID,Sentence,isValid,Unique ID
27,These results suggest that PROTEIN may act as a negative regulator for the transcription of PROTEIN PROTEIN PROTEIN1 and PROTEIN2 ,False,U_11
63,"The PROTEIN regulon includes a penicillin binding protein ( PROTEIN and a co-transcribed amino acid racemase ( PROTEIN1 , homologues of signal peptide peptidase ( PROTEIN , flotillin ( PROTEIN2 , ABC transporters ( PROTEIN , non-haem bromoperoxidase ( PROTEIN , epoxide hydrolase ( PROTEIN and three small peptides with structural similarities to bacteriocin precursor polypeptides.",False,U_25
99,"The PROTEIN and PROTEIN genes are recognized primarily by the forespore-specific sigma factor for RNA polymerase, PROTEIN the PROTEIN1 PROTEIN operon is recognized equally well by PROTEIN and the other forespore-specific sigma factor, PROTEIN2 ",True,U_27
135,"A low level of PROTEIN activated transcription of PROTEIN1 by PROTEIN2 RNA polymerase in vitro, but a higher level of PROTEIN repressed PROTEIN transcription.",True,U_35
171,"In vivo studies of the activity of four of the kinases, KinA, KinC, KinD (ykvD) and KinE (ykrQ), using abrB transcription as an indicator of Spo0A~P level, revealed that PROTEIN1 and PROTEIN2 were responsible for PROTEIN production during the exponential phase of growth in the absence of KinA and KinB.",False,U_48
207,From these results we conclude that PROTEIN1 negatively regulates PROTEIN expression by preventing PROTEIN driven transcription of PROTEIN2 possibly through interaction with the control region.,True,U_59
243,"PROTEIN1 at low concentration repressed PROTEIN transcription, whereas a higher concentration only partially repressed PROTEIN transcription and had little effect on PROTEIN2 transcription.",True,U_65
279,"The class includes AsiA form bacteriophage T4, which inhibits Escherichia coli sigma 70; PROTEIN1 present in both gram-positive and gram-negative bacteria, which inhibits the flagella sigma factor PROTEIN PROTEIN which inhibits the sporulation-specific sigma factor, PROTEIN and PROTEIN of Bacillus subtilis; PROTEIN of B. subtilis, which inhibits stress response sigma factor PROTEIN2 and PROTEIN a general regulator of the heat shock response, which in bacteria inhibits the heat shock sigma factor PROTEIN ",False,U_70
315,PROTEIN negatively controls the transcription of PROTEIN by stimulating the transcription of PROTEIN1 PROTEIN thereby increasing the production of the PROTEIN2 antisigma factor that inhibits PROTEIN activity.,False,U_75
